<?xml version="1.0" encoding="UTF-8"?>
<!DOCTYPE connectionList SYSTEM "../../../dtd/connect.dtd">
<connectionList pubno="EM21Q2EV">
	<connector type="rb" code="3">
		<pin>
			<line id="1" color="L">
				<connector type="conn" code="J21" subcode="A">
					<pin no="1"/>
				</connector>
			</line>
		</pin>
	</connector>
	<connector type="conn" code="J33">
		<pin no="1">
			<line id="2" color="W-B">
				<connector type="w2w" code="IC1" sex="male">
					<pin no="4"/>
				</connector>
			</line>
		</pin>
	</connector>
	<connector type="w2w" code="IC1" sex="female">
		<pin no="4">
			<line id="3" color="W-B">
				<connector type="conn" code="P5">
					<pin no="3"/>
				</connector>
			</line>
		</pin>
	</connector>
	<connector type="conn" code="J18" subcode="A">
		<pin no="1">
			<line id="4" color="L">
				<connector type="conn" code="J22" subcode="B">
					<pin no="5"/>
				</connector>
			</line>
		</pin>
	</connector>
	<connector type="conn" code="J21" subcode="A">
		<pin no="2">
			<line id="5" color="L">
				<connector type="conn" code="J31" subcode="A">
					<pin no="1"/>
				</connector>
			</line>
		</pin>
	</connector>
	<connector type="conn" code="J32" subcode="B">
		<pin no="6">
			<line id="6" color="L">
				<connector type="conn" code="P10">
					<pin no="3"/>
				</connector>
			</line>
		</pin>
	</connector>
	<connector type="conn" code="J19" subcode="B">
		<pin no="6">
			<line id="7" color="L">
				<connector type="conn" code="P5">
					<pin no="6"/>
				</connector>
			</line>
		</pin>
	</connector>
	<connector type="conn" code="J18" subcode="A">
		<pin no="2">
			<line id="8" color="L">
				<connector type="w2w" code="BB1" sex="male">
					<pin no="8"/>
				</connector>
			</line>
		</pin>
	</connector>
	<connector type="conn" code="J31" subcode="A">
		<pin no="2">
			<line id="9" color="L">
				<connector type="w2w" code="BC1" sex="male">
					<pin no="8"/>
				</connector>
			</line>
		</pin>
	</connector>
	<connector type="conn" code="P6">
		<pin no="2">
			<line id="10" color="R">
				<connector type="conn" code="P5">
					<pin no="4"/>
				</connector>
			</line>
		</pin>
	</connector>
	<connector type="conn" code="P6">
		<pin no="1">
			<line id="11" color="L-R">
				<connector type="conn" code="P5">
					<pin no="9"/>
				</connector>
			</line>
		</pin>
	</connector>
	<connector type="conn" code="P7">
		<pin no="2">
			<line id="12" color="R">
				<connector type="conn" code="P10">
					<pin no="2"/>
				</connector>
			</line>
		</pin>
	</connector>
	<connector type="conn" code="P10">
		<pin no="1">
			<line id="13" color="R-L">
				<connector type="w2w" code="IL1" sex="female">
					<pin no="3"/>
				</connector>
			</line>
		</pin>
	</connector>
	<connector type="w2w" code="IL1" sex="male">
		<pin no="3">
			<line id="14" color="R-L">
				<connector type="w2w" code="IC1" sex="male">
					<pin no="10"/>
				</connector>
			</line>
		</pin>
	</connector>
	<connector type="w2w" code="IC1" sex="female">
		<pin no="10">
			<line id="15" color="R-L">
				<connector type="conn" code="P5">
					<pin no="18"/>
				</connector>
			</line>
		</pin>
	</connector>
	<connector type="conn" code="P10">
		<pin no="4">
			<line id="16" color="G-W">
				<connector type="w2w" code="IL1" sex="female">
					<pin no="4"/>
				</connector>
			</line>
		</pin>
	</connector>
	<connector type="w2w" code="IL1" sex="male">
		<pin no="4">
			<line id="17" color="G-W">
				<connector type="w2w" code="IC1" sex="male">
					<pin no="3"/>
				</connector>
			</line>
		</pin>
	</connector>
	<connector type="w2w" code="IC1" sex="female">
		<pin no="3">
			<line id="18" color="G-W">
				<connector type="conn" code="P5">
					<pin no="15"/>
				</connector>
			</line>
		</pin>
	</connector>
	<connector type="conn" code="P7">
		<pin no="1">
			<line id="19" color="L-R">
				<connector type="conn" code="P10">
					<pin no="5"/>
				</connector>
			</line>
		</pin>
	</connector>
	<connector type="w2w" code="BB1" sex="female">
		<pin no="8">
			<line id="20" color="L">
				<connector type="conn" code="P11">
					<pin no="3"/>
				</connector>
			</line>
		</pin>
	</connector>
	<connector type="conn" code="P8">
		<pin no="2">
			<line id="21" color="R">
				<connector type="conn" code="P11">
					<pin no="2"/>
				</connector>
			</line>
		</pin>
	</connector>
	<connector type="conn" code="P11">
		<pin no="1">
			<line id="22" color="R-B">
				<connector type="w2w" code="BB1" sex="female">
					<pin no="6"/>
				</connector>
			</line>
		</pin>
	</connector>
	<connector type="w2w" code="BB1" sex="male">
		<pin no="6">
			<line id="23" color="R-Y">
				<connector type="w2w" code="IC1" sex="male">
					<pin no="2"/>
				</connector>
			</line>
		</pin>
	</connector>
	<connector type="w2w" code="IC1" sex="female">
		<pin no="2">
			<line id="24" color="R-Y">
				<connector type="conn" code="P5">
					<pin no="12"/>
				</connector>
			</line>
		</pin>
	</connector>
	<connector type="conn" code="P11">
		<pin no="4">
			<line id="25" color="G-B">
				<connector type="w2w" code="BB1" sex="female">
					<pin no="7"/>
				</connector>
			</line>
		</pin>
	</connector>
	<connector type="w2w" code="BB1" sex="male">
		<pin no="7">
			<line id="26" color="G-Y">
				<connector type="w2w" code="IC1" sex="male">
					<pin no="1"/>
				</connector>
			</line>
		</pin>
	</connector>
	<connector type="w2w" code="IC1" sex="female">
		<pin no="1">
			<line id="27" color="G-Y">
				<connector type="conn" code="P5">
					<pin no="13"/>
				</connector>
			</line>
		</pin>
	</connector>
	<connector type="conn" code="P8">
		<pin no="1">
			<line id="28" color="L-R">
				<connector type="conn" code="P11">
					<pin no="5"/>
				</connector>
			</line>
		</pin>
	</connector>
	<connector type="w2w" code="BC1" sex="female">
		<pin no="8">
			<line id="29" color="L">
				<connector type="conn" code="P12">
					<pin no="3"/>
				</connector>
			</line>
		</pin>
	</connector>
	<connector type="conn" code="P9">
		<pin no="2">
			<line id="30" color="R">
				<connector type="conn" code="P12">
					<pin no="2"/>
				</connector>
			</line>
		</pin>
	</connector>
	<connector type="conn" code="P12">
		<pin no="1">
			<line id="31" color="R-B">
				<connector type="w2w" code="BC1" sex="female">
					<pin no="6"/>
				</connector>
			</line>
		</pin>
	</connector>
	<connector type="w2w" code="BC1" sex="male">
		<pin no="6">
			<line id="32" color="R-B">
				<connector type="w2w" code="IC1" sex="male">
					<pin no="6"/>
				</connector>
			</line>
		</pin>
	</connector>
	<connector type="w2w" code="IC1" sex="female">
		<pin no="6">
			<line id="33" color="R-B">
				<connector type="conn" code="P5">
					<pin no="10"/>
				</connector>
			</line>
		</pin>
	</connector>
	<connector type="conn" code="P12">
		<pin no="4">
			<line id="34" color="G-B">
				<connector type="w2w" code="BC1" sex="female">
					<pin no="7"/>
				</connector>
			</line>
		</pin>
	</connector>
	<connector type="w2w" code="BC1" sex="male">
		<pin no="7">
			<line id="35" color="G-B">
				<connector type="w2w" code="IC1" sex="male">
					<pin no="5"/>
				</connector>
			</line>
		</pin>
	</connector>
	<connector type="w2w" code="IC1" sex="female">
		<pin no="5">
			<line id="36" color="G-B">
				<connector type="conn" code="P5">
					<pin no="16"/>
				</connector>
			</line>
		</pin>
	</connector>
	<connector type="conn" code="P9">
		<pin no="1">
			<line id="37" color="L-R">
				<connector type="conn" code="P12">
					<pin no="5"/>
				</connector>
			</line>
		</pin>
	</connector>
</connectionList>
